{
  "$id": "quansio://schema/ModelRequestEnvelope/9.0.0",
  "$schema": "https://json-schema.org/draft/2020-12/schema",
  "additionalProperties": false,
  "properties": {
    "cancellation_id": {
      "minLength": 1,
      "type": "string"
    },
    "capability_snapshot_id": {
      "minLength": 1,
      "type": "string"
    },
    "context_projection_id": {
      "minLength": 1,
      "type": "string"
    },
    "created_at": {
      "format": "date-time",
      "type": "string"
    },
    "execution_generation": {
      "minimum": 1,
      "type": "integer"
    },
    "messages": {
      "items": {
        "type": "object"
      },
      "minItems": 1,
      "type": "array"
    },
    "model_profile_id": {
      "minLength": 1,
      "type": "string"
    },
    "privacy_decision_id": {
      "minLength": 1,
      "type": "string"
    },
    "request_id": {
      "minLength": 1,
      "type": "string"
    },
    "residency_policy_id": {
      "minLength": 1,
      "type": "string"
    },
    "route_decision_id": {
      "minLength": 1,
      "type": "string"
    },
    "run_id": {
      "minLength": 1,
      "type": "string"
    },
    "sampling": {
      "type": "object"
    },
    "schema_revision": {
      "const": "9.0.0"
    },
    "step_id": {
      "minLength": 1,
      "type": "string"
    },
    "stream_id": {
      "minLength": 1,
      "type": "string"
    },
    "tenant_id": {
      "minLength": 1,
      "type": "string"
    },
    "tools": {
      "items": {
        "type": "object"
      },
      "type": "array"
    },
    "trace_id": {
      "minLength": 1,
      "type": "string"
    },
    "usage_reservation_id": {
      "minLength": 1,
      "type": "string"
    },
    "workspace_id": {
      "minLength": 1,
      "type": "string"
    }
  },
  "required": [
    "schema_revision",
    "request_id",
    "tenant_id",
    "workspace_id",
    "run_id",
    "step_id",
    "execution_generation",
    "route_decision_id",
    "model_profile_id",
    "capability_snapshot_id",
    "context_projection_id",
    "usage_reservation_id",
    "stream_id",
    "cancellation_id",
    "messages",
    "created_at"
  ],
  "title": "ModelRequestEnvelope",
  "type": "object"
}
